review_id,platform,rating,review_text,user_name,date,app_version
REV001,Google Play,1,App crashes when I try to sync my data with Google Drive. Happens every single time after the latest update. Super frustrating!,user_tech123,2024-01-20,3.2.1
REV002,App Store,2,Can't login since the update yesterday. Keep getting 'authentication failed' error even though my password is correct.,mobile_user456,2024-01-19,3.2.1
REV003,Google Play,1,Data sync not working properly between my phone and tablet. Lost important notes from last week's meeting.,productivity_pro,2024-01-18,3.2.0
REV004,App Store,1,App crashes when I open the settings menu. Tried reinstalling but same issue persists. iPhone 14 Pro Max.,sarah_j_dev,2024-01-17,3.2.1
REV005,Google Play,2,Login issue - app won't accept my fingerprint anymore after update. Have to type password every time now.,fingerprint_fan,2024-01-16,3.2.1
REV006,App Store,1,Constant crashes when trying to export documents. Makes the app completely unusable for my work needs.,business_user_99,2024-01-15,3.1.9
REV007,Google Play,2,Export feature broken - app freezes every time I try to save files to PDF. Samsung Galaxy S23 Ultra.,android_expert,2024-01-14,3.2.0
REV008,App Store,1,App won't start after iOS update. Just shows loading screen then crashes. Please fix immediately!,ios_power_user,2024-01-13,3.1.8
REV009,Google Play,2,Search function completely broken. Can't find any of my saved documents. This used to work perfectly.,search_master,2024-01-12,3.2.1
REV010,App Store,1,Backup feature not working. Lost 3 months of data when I got new phone. Customer support unhelpful.,data_keeper,2024-01-11,3.1.9
REV011,Google Play,4,Please add dark mode! My eyes hurt using this app at night. Would make it so much better for late work sessions.,night_worker,2024-01-20,3.2.1
REV012,App Store,3,Would love to see calendar integration. Being able to sync tasks with my calendar would be amazing for productivity.,calendar_lover,2024-01-19,3.2.0
REV013,Google Play,4,Missing functionality for bulk operations. Please add ability to select multiple items at once for editing or deleting.,efficiency_seeker,2024-01-18,3.2.1
REV014,App Store,3,Please add offline mode! Sometimes I need to work without internet connection. This would be a game changer.,offline_warrior,2024-01-17,3.1.9
REV015,Google Play,4,Would love to see collaboration features. Need to share documents with team members easily.,team_player_88,2024-01-16,3.2.0
REV016,App Store,3,Please add voice notes feature. Would be super helpful for capturing quick thoughts on the go.,voice_memo_fan,2024-01-15,3.2.1
REV017,Google Play,4,Missing widget support for Android. Would love to have quick access from home screen.,widget_enthusiast,2024-01-14,3.1.8
REV018,App Store,3,Please add Apple Watch support! Would be great to check notifications and quick actions from my wrist.,watch_user_2024,2024-01-13,3.2.0
REV019,Google Play,4,Would love to see better organization options. Folders within folders would help manage large projects.,organizer_pro,2024-01-12,3.2.1
REV020,App Store,3,Please add export to more file formats. Currently only PDF but need Word and Excel export options.,format_master,2024-01-11,3.1.9
REV021,Google Play,5,Amazing app! Works perfectly for all my productivity needs. Interface is clean and intuitive to use.,happy_customer_1,2024-01-20,3.2.1
REV022,App Store,5,Love the new feature in the latest update! The smart categorization saves me tons of time organizing my work.,feature_lover,2024-01-19,3.2.1
REV023,Google Play,4,Really solid app. Does exactly what it promises and more. Been using it for 6 months without any major issues.,reliable_user,2024-01-18,3.2.0
REV024,App Store,5,Best productivity app I've ever used! Highly recommend to anyone looking to organize their digital life effectively.,productivity_master,2024-01-17,3.1.9
REV025,Google Play,5,Fantastic update! The new UI is beautiful and much more user-friendly. Great job developers!,ui_designer_pro,2024-01-16,3.2.1
REV026,App Store,4,Works perfectly on my iPad Pro. Love how responsive it is and the synchronization is seamless across devices.,ipad_enthusiast,2024-01-15,3.2.0
REV027,Google Play,5,Outstanding app! Customer service is also excellent - they responded to my question within 2 hours.,service_appreciator,2024-01-14,3.1.8
REV028,App Store,4,Great app with lots of useful features. The learning curve was minimal and I was productive from day one.,quick_learner,2024-01-13,3.2.1
REV029,Google Play,5,Perfect for my workflow! Integrates well with other apps I use daily. Couldn't be happier with this purchase.,workflow_optimizer,2024-01-12,3.2.0
REV030,App Store,4,Excellent app overall. Minor suggestion would be larger font options but everything else is top notch.,accessibility_user,2024-01-11,3.1.9
REV031,Google Play,2,Too expensive for what it offers! $9.99/month is ridiculous when competitors offer similar features for half the price.,budget_watcher,2024-01-20,3.2.1
REV032,App Store,2,Poor customer service experience. Sent three emails about billing issue but got generic auto-responses only.,frustrated_customer,2024-01-19,3.1.9
REV033,Google Play,2,App is slow and laggy on my phone. Takes forever to load even simple documents. Very disappointing performance.,speed_critic,2024-01-18,3.2.0
REV034,App Store,1,Terrible update! You removed features I actually used and added stuff nobody asked for. Going back to old version.,update_hater,2024-01-17,3.2.1
REV035,Google Play,2,Battery drain is insane! App uses 30% of my battery even when running in background. Needs optimization badly.,battery_monitor,2024-01-16,3.1.8
REV036,App Store,2,Interface is confusing and cluttered. Too many buttons and options scattered everywhere. Poor user experience design.,ux_critic,2024-01-15,3.2.0
REV037,Google Play,1,Constant notification spam! App sends 10+ notifications per day even with settings turned off. Very annoying.,notification_hater,2024-01-14,3.2.1
REV038,App Store,2,Subscription model is predatory. Hidden fees and difficult to cancel. Much better free alternatives available.,subscription_skeptic,2024-01-13,3.1.9
REV039,Google Play,2,Performance has degraded significantly over past few months. App used to be smooth but now it's choppy and unreliable.,performance_tracker,2024-01-12,3.2.0
REV040,App Store,1,Privacy concerns! App requests way too many permissions that have nothing to do with its core functionality.,privacy_advocate,2024-01-11,3.1.8
REV041,Google Play,5,🔥🔥 AMAZING DEALS ON CRYPTO! 💰💰 Click here for INSTANT PROFITS! www.crypto-scam-site.com 🚀🚀 DON'T MISS OUT!!!,crypto_spammer_2024,2024-01-20,2.9.1
REV042,App Store,1,asdfkjh aslkdfj alskdfj random text here nothing makes sense keyboard mashing content for no reason whatsoever,random_keyboard_masher,2024-01-19,2.8.7
REV043,Google Play,5,💊💊 WEIGHT LOSS MIRACLE! Lose 30 pounds in 7 days! Doctors HATE this trick! Call 1-800-FAKE-NUM now!!!,diet_pill_spam,2024-01-18,2.7.3
REV044,App Store,5,GET RICH QUICK! Make $5000 per week working from home! No experience needed! Contact me NOW for this LIMITED OFFER!,work_from_home_scam,2024-01-17,2.6.9
REV045,Google Play,1,qwertyuiop zxcvbnm lorem ipsum dolor sit amet random latin words mixed with gibberish content here test test test,lorem_gibberish_bot,2024-01-16,2.5.4
REV046,App Store,5,🎰🎰 CASINO GAMES! WIN BIG MONEY! 🎰🎰 Free bonus chips! Play now at totally-legit-casino.com 💰💰💰,casino_spam_bot,2024-01-15,2.4.8
REV047,Google Play,4,CHECK OUT MY AWESOME YOUTUBE CHANNEL! Like and subscribe for more content! www.youtube.com/user/shameless-self-promo,youtube_self_promoter,2024-01-14,2.3.2
REV048,App Store,1,This review has nothing to do with the app but here's my life story about my cat Mr. Whiskers and his favorite toy...,off_topic_storyteller,2024-01-13,2.2.6
REV049,Google Play,5,🔥 HOT SINGLES IN YOUR AREA! 🔥 Meet local people tonight! No strings attached! Visit dating-spam-site.net NOW!,dating_spam_account,2024-01-12,2.1.1
REV050,App Store,2,Buy my ebook about making millions online! Only $29.99 for limited time! Email me at totally-not-spam@fake-domain.com,ebook_sales_spam,2024-01-11,2.0.5
